{
  "schema": "vehiclehub.wican.vehicle-profile.v1",
  "profile_id": "toyota-camry-2020-xse-ice",
  "profile_version": "0.1.0-draft.1",
  "status": "draft",
  "title": "Toyota Camry 2020 XSE (ICE) - incomplete draft",
  "vehicle": {
    "make": "Toyota",
    "model": "Camry",
    "model_years": [
      2020
    ],
    "variant": "XSE",
    "powertrain": "ice"
  },
  "compatibility": {
    "hardware": [
      "WICAN_PRO"
    ],
    "firmware_min": "1.1.0-rc.7",
    "firmware_capabilities": [
      "autopid.groups.v1"
    ],
    "vehicle_state_provider": "ice_obd_rpm"
  },
  "vehiclehub": {
    "telemetry_contract": "vehiclehub.wican.autopid.v1",
    "vehiclehub_profile_id": "toyota_camry_2020_xse_ice",
    "trip_groups": [
      "fast"
    ],
    "required_fields": {
      "fast": [
        "0C-EngineRPM",
        "0D-VehicleSpeed",
        "10-MAFAirFlowRate"
      ]
    },
    "backend_owned_calculations": [
      "fuel_rate_from_maf",
      "instant_mpg",
      "trip_distance",
      "trip_fuel",
      "fuel_trim_correction",
      "coasting_fuel_cut",
      "unit_conversions"
    ],
    "group_topic_template": "{topic_base}/autopid/group/{slug}"
  },
  "autopid": {
    "car_init": null,
    "period_bounds_ms": {
      "min": 1000,
      "max": 3600000
    },
    "groups": [
      {
        "id": "fast",
        "name": "Fast",
        "status": "unverified",
        "enabled": true,
        "period_ms": null,
        "adjustable_period": true,
        "can_disable": true,
        "condition": "always",
        "mqtt_topic": "{topic_base}/autopid/group/fast",
        "pids": [
          {
            "id": "0c-enginerpm",
            "pid": "010C",
            "pid_type": "std",
            "enabled": true,
            "user_toggle": true,
            "description": "0C-EngineRPM",
            "parameters": [
              {
                "name": "0C-EngineRPM",
                "expression": "",
                "status": "unverified",
                "destination_type": "MQTT_Grp",
                "enabled": true
              }
            ]
          },
          {
            "id": "0d-vehiclespeed",
            "pid": "010D",
            "pid_type": "std",
            "enabled": true,
            "user_toggle": true,
            "description": "0D-VehicleSpeed",
            "parameters": [
              {
                "name": "0D-VehicleSpeed",
                "expression": "",
                "status": "unverified",
                "destination_type": "MQTT_Grp",
                "enabled": true
              }
            ]
          },
          {
            "id": "10-mafairflowrate",
            "pid": "0110",
            "pid_type": "std",
            "enabled": true,
            "user_toggle": true,
            "description": "10-MAFAirFlowRate",
            "parameters": [
              {
                "name": "10-MAFAirFlowRate",
                "expression": "",
                "status": "unverified",
                "destination_type": "MQTT_Grp",
                "enabled": true
              }
            ]
          },
          {
            "id": "9d-enginefuelrate",
            "pid": "019D",
            "pid_type": "std",
            "enabled": true,
            "user_toggle": true,
            "description": "9D-EngineFuelRate",
            "parameters": [
              {
                "name": "9D-EngineFuelRate",
                "expression": "",
                "status": "unverified",
                "destination_type": "MQTT_Grp",
                "enabled": true
              }
            ]
          },
          {
            "id": "44-fuelaircmdequiv",
            "pid": "0144",
            "pid_type": "std",
            "enabled": true,
            "user_toggle": true,
            "description": "44-FuelAirCmdEquiv",
            "parameters": [
              {
                "name": "44-FuelAirCmdEquiv",
                "expression": "",
                "status": "unverified",
                "destination_type": "MQTT_Grp",
                "enabled": true
              }
            ]
          },
          {
            "id": "11-throttleposition",
            "pid": "0111",
            "pid_type": "std",
            "enabled": true,
            "user_toggle": true,
            "description": "11-ThrottlePosition",
            "parameters": [
              {
                "name": "11-ThrottlePosition",
                "expression": "",
                "status": "unverified",
                "destination_type": "MQTT_Grp",
                "enabled": true
              }
            ]
          }
        ]
      },
      {
        "id": "medium",
        "name": "Medium",
        "status": "unverified",
        "enabled": true,
        "period_ms": null,
        "adjustable_period": true,
        "can_disable": true,
        "condition": "always",
        "mqtt_topic": "{topic_base}/autopid/group/medium",
        "pids": [
          {
            "id": "43-absloadvalue",
            "pid": "0143",
            "pid_type": "std",
            "enabled": true,
            "user_toggle": true,
            "description": "43-AbsLoadValue",
            "parameters": [
              {
                "name": "43-AbsLoadValue",
                "expression": "",
                "status": "unverified",
                "destination_type": "MQTT_Grp",
                "enabled": true
              }
            ]
          },
          {
            "id": "0e-timingadvance",
            "pid": "010E",
            "pid_type": "std",
            "enabled": true,
            "user_toggle": true,
            "description": "0E-TimingAdvance",
            "parameters": [
              {
                "name": "0E-TimingAdvance",
                "expression": "",
                "status": "unverified",
                "destination_type": "MQTT_Grp",
                "enabled": true
              }
            ]
          },
          {
            "id": "04-calcengineload",
            "pid": "0104",
            "pid_type": "std",
            "enabled": true,
            "user_toggle": true,
            "description": "04-CalcEngineLoad",
            "parameters": [
              {
                "name": "04-CalcEngineLoad",
                "expression": "",
                "status": "unverified",
                "destination_type": "MQTT_Grp",
                "enabled": true
              }
            ]
          },
          {
            "id": "45-relthrottlepos",
            "pid": "0145",
            "pid_type": "std",
            "enabled": true,
            "user_toggle": true,
            "description": "45-RelThrottlePos",
            "parameters": [
              {
                "name": "45-RelThrottlePos",
                "expression": "",
                "status": "unverified",
                "destination_type": "MQTT_Grp",
                "enabled": true
              }
            ]
          },
          {
            "id": "62-actualengtorqpct",
            "pid": "0162",
            "pid_type": "std",
            "enabled": true,
            "user_toggle": true,
            "description": "62-ActualEngTorqPct",
            "parameters": [
              {
                "name": "62-ActualEngTorqPct",
                "expression": "",
                "status": "unverified",
                "destination_type": "MQTT_Grp",
                "enabled": true
              }
            ]
          },
          {
            "id": "06-shortfueltrimbank1",
            "pid": "0106",
            "pid_type": "std",
            "enabled": true,
            "user_toggle": true,
            "description": "06-ShortFuelTrimBank1",
            "parameters": [
              {
                "name": "06-ShortFuelTrimBank1",
                "expression": "",
                "status": "unverified",
                "destination_type": "MQTT_Grp",
                "enabled": true
              }
            ]
          },
          {
            "id": "07-longfueltrimbank1",
            "pid": "0107",
            "pid_type": "std",
            "enabled": true,
            "user_toggle": true,
            "description": "07-LongFuelTrimBank1",
            "parameters": [
              {
                "name": "07-LongFuelTrimBank1",
                "expression": "",
                "status": "unverified",
                "destination_type": "MQTT_Grp",
                "enabled": true
              }
            ]
          },
          {
            "id": "08-shortfueltrimbank2",
            "pid": "0108",
            "pid_type": "std",
            "enabled": true,
            "user_toggle": true,
            "description": "08-ShortFuelTrimBank2",
            "parameters": [
              {
                "name": "08-ShortFuelTrimBank2",
                "expression": "",
                "status": "unverified",
                "destination_type": "MQTT_Grp",
                "enabled": true
              }
            ]
          },
          {
            "id": "09-longfueltrimbank2",
            "pid": "0109",
            "pid_type": "std",
            "enabled": true,
            "user_toggle": true,
            "description": "09-LongFuelTrimBank2",
            "parameters": [
              {
                "name": "09-LongFuelTrimBank2",
                "expression": "",
                "status": "unverified",
                "destination_type": "MQTT_Grp",
                "enabled": true
              }
            ]
          }
        ]
      },
      {
        "id": "slow",
        "name": "Slow",
        "status": "unverified",
        "enabled": true,
        "period_ms": null,
        "adjustable_period": true,
        "can_disable": true,
        "condition": "always",
        "mqtt_topic": "{topic_base}/autopid/group/slow",
        "pids": [
          {
            "id": "33-absbaropres",
            "pid": "0133",
            "pid_type": "std",